<?xml version="1.0" encoding="utf-8"?>

<transducer size="4" xmlns:xsi="http://www.w3.org/2001/XMLSchema-instance"
  xsi:noNamespaceSchemaLocation="schema.xsd">

  <nodes>
    <node id="0" initial="true" />
    <node id="1" />
    <node id="2" />
    <node id="3" accepting="true" />
  </nodes>
  
  <transitions>
    <transition from="0" to="1" input="a" output="b" />
    <transition from="0" to="2" input="a" output="c" />
    <transition from="1" to="3" input="h" output="h" />
    <transition from="2" to="3" input="e" output="e" />
  </transitions>
</transducer>